sample_id,ambiguous_question,annotation_id,long_answer,knowledge,wikipages,qa_pair_id,sub_question,short_answers
4474597907223412132,Who were the two astronauts who stayed a year on the iss?,0,The astronauts who stayed a year on the International Space Station were American astronaut Scott Kelly and Russian astronaut Mikhail Borisovich Kornienko. ,"The ISS year-long mission was an 11 month scientific research project aboard the International Space Station, which studied the health effects of long-term spaceflight.","ISS year-long mission: https://en.wikipedia.org/wiki/ISS%20year-long%20mission
International Space Station: https://en.wikipedia.org/wiki/International%20Space%20Station",1,Who was the astronaut from the Russia who stayed a year on the iss?,"Mikhail Borisovich Kornienko, Mikhail Kornienko"
4214526319411191996,Who played the chicago cubs in the world series last year?,1,"The Chicago Cubs played the Detroit Tigers twice in the world series, 1907 and 1908. And more recently, they played the Cleveland Indians in the 2016 World Series.",[NO_KNOWLEDGE_AVAILABLE],"1945 World Series: https://en.wikipedia.org/wiki/1945%20World%20Series
Chicago Cubs: https://en.wikipedia.org/wiki/Chicago%20Cubs
1935 World Series: https://en.wikipedia.org/wiki/1935%20World%20Series",0,Who played the Chicago Cubs in the 2016 World Series?,Cleveland Indians
8662694625133711073,What is the speed limit through the hindhead tunnel?,1,"The speed limit through the Hindhead Tunnel is 70 in miles per hour, or mph, and is 113 in kilometers per hour, or km/h. The 1.15-mile tunnel is part of the 4-mile dual-carriageway Hindhead bypass that replaced one of the last remaining stretches of single-carriageway on the 68-mile A3, the London to Portsmouth road.","The Hindhead Tunnel, opened in 2011, is part of the 4-mile (6.4 km) dual-carriageway Hindhead bypass that replaced one of the last remaining stretches of single-carriageway on the 68-mile (109 km) A3, the London to Portsmouth road.
At 1.15 miles (1.85 kilometres) in length,[4] the tunnel is the longest non-estuarial road tunnel in the United Kingdom, and takes the road beneath the Devil's Punch Bowl, a Site of Special Scientific Interest.
Miles per hour (mph or mi/h) is a British imperial and United States customary unit of speed expressing the number of miles travelled in one hour.
The kilometre per hour (SI symbol: km/h; abbreviations: kph, kmph, km/hr) is a unit of speed, expressing the number of kilometres travelled in one hour.",Hindhead Tunnel: https://en.wikipedia.org/wiki/Hindhead%20Tunnel,2,What is the speed limit through the hindhead tunnel in mph?,70
5726344363373010009,How much does a trump golf membership cost?,0,"The Trump Organization owns or manages seventeen golf courses in the United States, Scotland, Ireland, and the United Arab Emirates. The Trump National Golf Club of Westchester is a private golf club in Briarcliff Manor, New York. Before the 2008 recession, initiation fees for the club were $100,000 to $150,000. As of late 2015, initiation fees were down to $50,000. Annual dues were $19,400 a year. Their International Golf Club in West Palm Beach is a private 27-hole golf course with a regular initiation fee for membership of $150,000 in 2011, and the annual fee $25,000. Their National Golf Club in Bedminster, New Jersey is a private golf club with the highest membership being $300,000.","Trump National Golf Club Westchester is a private golf club in Briarcliff Manor, New York. The 140-acre (57 ha) course has eighteen holes, with a 75,000-square-foot (7,000 m2) clubhouse. 
Trump International Golf Club, West Palm Beach is a private 27-hole golf course in West Palm Beach, Florida. 
Trump National Golf Club is a private golf club located on Lamington Road in Bedminster, New Jersey.
The Trump Organization owns or manages seventeen golf courses in the United States, Scotland, Ireland, and the United Arab Emirates.","Trump National Golf Club (Los Angeles): https://en.wikipedia.org/wiki/Trump%20National%20Golf%20Club%20%28Los%20Angeles%29
Trump National Golf Club (Washington, D.C.): https://en.wikipedia.org/wiki/Trump%20National%20Golf%20Club%20%28Washington%2C%20D.C.%29
Pine Valley Golf Club: https://en.wikipedia.org/wiki/Pine%20Valley%20Golf%20Club
Trump National Golf Club Westchester: https://en.wikipedia.org/wiki/Trump%20National%20Golf%20Club%20Westchester
Trump National Golf Club (Bedminster, New Jersey): https://en.wikipedia.org/wiki/Trump%20National%20Golf%20Club%20%28Bedminster%2C%20New%20Jersey%29
Trump International Golf Club (West Palm Beach): https://en.wikipedia.org/wiki/Trump%20International%20Golf%20Club%20%28West%20Palm%20Beach%29
Trump National Doral Miami: https://en.wikipedia.org/wiki/Trump%20National%20Doral%20Miami",2,How much does the initiation fee at Trump National Golf Club Westchester cost as of 2015?|How much are the initiation fees for a trump golf membership in Westchester in 2015?,"$50,000"
2240932998074597895,Who does the voice of darth vader in star wars?,0,"The Star Wars franchise' fictional character Darth Vader is voiced by different voice actors. One of the iconic sound effects heard in the Star Wars film franchise, the heavy-breathing sound of Darth Vader was created by American sound designer and voice actor Ben Burtt. In the 1981 Star Wars radio drama, Darth Vader is featured and voiced by the actor Brock Peters. Although Spencer Wilding and Daniel Naprous portrayed Vader in 2016 Star Wars Rogue One film, voice actor James Earl Jones reprised the voice role for Vader's appearances in the Star Wars Episodes III-VI and Star Wars Rebels film.","Darth Vader is a fictional character in the Star Wars franchise. 
Burtt is notable for popularizing the Wilhelm scream in-joke and creating many of the iconic sound effects heard in the Star Wars film franchise, including the 'voice' of R2-D2, the lightsaber hum, the sound of the blaster guns, the heavy-breathing sound of Darth Vader and creating the Ewoks’ language, ewokese. 
Benjamin Burtt Jr. (born July 12, 1948) is an American sound designer, film editor, director, screenwriter, and voice actor.
Both Spencer Wilding and Daniel Naprous portrayed Vader in Rogue One (2016), with Jones reprising his role as the character's voice.
Spencer Lee Wilding[1] (born 26 July 1972) is a Welsh actor and special creature performer in the UK.
He became well known as the voice of Darth Vader in the original Star Wars film trilogy, released between 1977 and 1983. 
James Earl Jones makes an uncredited cameo appearance, reprising his role from previous films as the voice of Darth Vader.",Darth Vader: https://en.wikipedia.org/wiki/Darth%20Vader,0,"Who voices Darth Vader in Star Wars Episodes III-VI, IX Rogue One, and Rebels?",James Earl Jones
-285728796551513770,Why did the roman catholic and eastern orthodox split?,1,"The East–West Schism (also the Great Schism or Schism of 1054) is the break of communion since the 11th century between the Catholic Church and Eastern Orthodox Church. The schism was the culmination of theological and political differences which had developed during the preceding centuries between Eastern and Western Christianity. The specific doctrinal reasons for why the Roman Catholic and Eastern Orthodox church split include the procession of the Holy Spirit, whether leavened or unleavened bread should be used in the Eucharist, the Bishop of Rome's claim to universal jurisdiction, and the place of the See of Constantinople in relation to the Pentarchy.","The East–West Schism (also the Great Schism or Schism of 1054) is the break of communion since the 11th century between the Catholic Church and Eastern Orthodox Church.[1]
The schism was the culmination of theological and political differences which had developed during the preceding centuries between Eastern and Western Christianity.",East–West Schism: https://en.wikipedia.org/wiki/East%E2%80%93West%20Schism,1,What are specific doctrinal reasons for why the roman catholic and eastern orthodox split?,"the procession of the Holy Spirit, whether leavened or unleavened bread should be used in the Eucharist, the Bishop of Rome's claim to universal jurisdiction, and the place of the See of Constantinople in relation to the Pentarchy"
1249880653163144885,Who plays snowman in smokey and the bandit?,1,"Smokey and the Bandit is a 1977 American road action comedy film starring Burt Reynolds, Sally Field, Jackie Gleason, Jerry Reed, Pat McCormick, Paul Williams and Mike Henry. The directorial debut of stuntman Hal Needham, the film follows Bo ""Bandit"" Darville, played by Reynolds, and Cledus ""Snowman"" Snow played by Jerry Reed, two bootleggers attempting to illegally transport 400 cases of Coors beer from Texarkana to Atlanta. There were three parts to this film with Reed staring as ""Snowman"" for all of them. ","Smokey and the Bandit is a 1977 American road action comedy film starring Burt Reynolds, Sally Field, Jackie Gleason, Jerry Reed, Pat McCormick, Paul Williams and Mike Henry. The directorial debut of stuntman Hal Needham, the film follows Bo ""Bandit"" Darville (Reynolds) and Cledus ""Snowman"" Snow (Reed), two bootleggers attempting to illegally transport 400 cases of Coors beer from Texarkana to Atlanta.","Jerry Reed: https://en.wikipedia.org/wiki/Jerry%20Reed
Smokey and the Bandit II: https://en.wikipedia.org/wiki/Smokey%20and%20the%20Bandit%20II
Smokey and the Bandit: https://en.wikipedia.org/wiki/Smokey%20and%20the%20Bandit
Smokey and the Bandit Part 3: https://en.wikipedia.org/wiki/Smokey%20and%20the%20Bandit%20Part%203",0,Who played Snowman in the original Smokey and the Bandit?,Jerry Reed
8787064710466316665,How many houses are in the british parliament?,1,"The Parliament of the United Kingdom is the supreme legislative body of the United Kingdom, the Crown dependencies and the British overseas territories. Parliament is bicameral but has 3 parts, consisting of the sovereign, otherwise known as Crown-in-Parliament or monarch, the House of Lords, and the House of Commons, which is the the primary chamber. British Parliament would consist of 2 parts if the monarch, or Crown-in -Parliament was not included.","The Parliament of the United Kingdom[note 1] is the supreme legislative body of the United Kingdom, the Crown dependencies and the British overseas territories.
Parliament is bicameral but has three parts, consisting of the sovereign (Crown-in-Parliament), the House of Lords, and the House of Commons (the primary chamber).",Parliament of the United Kingdom: https://en.wikipedia.org/wiki/Parliament%20of%20the%20United%20Kingdom,1,"How many parts are in the British parliament, not including the monarch?",2
-8636792970043412417,When was the last time australia won the ashes in england?,0,"Australia last won The Ashes, a Test cricket series played between England and Australia, in England on July 5, 2001, during Series 61. The Australia national cricket team won the series 4-1, retaining the Ashes, which had been in their possession since the 1989 Ashes series.","The Ashes is a Test cricket series played between England and Australia.
In 2001, the Australia national cricket team team travelled England and Ireland to play county matches and the 2001 The Ashes series. Australia won the Test series 4–1 and retained the Ashes, that had been in their possession since the 1989 Ashes series.","The Ashes: https://en.wikipedia.org/wiki/The%20Ashes
List of Ashes series: https://en.wikipedia.org/wiki/List%20of%20Ashes%20series",0,On what date was the last time Australia won the ashes in England?,"July 5, 2001"
-3221850497920722165,Who is the girl in zz top legs video?,1,"""Legs"" is a song performed by the band ZZ Top from their 1983 album Eliminator. The ""Legs"" video was the third and last of the Eliminator series of videos that introduced the now-iconic 1933 Ford, ""Eliminator girls"", Jeana Tomasino, Kymberly Herrin, and Danièle Arnaud, and ZZ Top-as-benevolent-spirits tropes, all of which have become firmly established aspects of the band's iconography. The salesgirl in the video was Wendy Frazier.","""Legs"" is a song performed by the band ZZ Top from their 1983 album Eliminator.
The ""Legs"" video was the third and last of the Eliminator series of videos that introduced the now-iconic 1933 Ford,[5] ""Eliminator girls"", and ZZ Top-as-benevolent-spirits tropes, all of which have become firmly established aspects of the band's iconography.",Legs (song): https://en.wikipedia.org/wiki/Legs%20%28song%29,1,Who are the Eliminator girls in zz top legs video?,"Danièle Arnaud, Jeana Tomasino, Kymberly Herrin"
-4995398567532229571,When did ragtime flourished in the united states?,0,"The musical style ragtime, flourished and peaked popularity in the united states between 1895 and 1919. But in the early 1970s, there was a major ragtime revival.",[NO_KNOWLEDGE_AVAILABLE],"Music history of the United States: https://en.wikipedia.org/wiki/Music%20history%20of%20the%20United%20States
Ragtime: https://en.wikipedia.org/wiki/Ragtime",0,When did ragtime flourish and have peak popularity in the united states?,"1895 and 1919, start of the 20th century"
-2397621688044860964,When did the song stayin alive come out?,1,"There are a number of songs entitled Stayin' Alive or Staying Alive. Music group The Bee Gees' song Stayin' Alive was released on 13 December 1977. Filipina singer Nina's song Staying Alive, featuring rap verses by Q-York, came out on November 19, 2011. American rock band Cursive's song Staying Alive came out on March 4, 2003.","The Bee Gees were a music group formed in 1958, featuring brothers Barry, Robin, and Maurice Gibb.
The Ugly Organ is the fourth studio album by American rock band Cursive, released on March 4, 2003, through Saddle Creek Records.
The closing track, ""Staying Alive"" is ten minutes long; it begins with guitar and cello parts, eventually leading to white noise and a choir repeating the phrase ""the worse is over"".
Stay Alive is the sixth studio album by Filipina singer Nina, released in the Philippines on November 19, 2011 by Universal Records.
The following track, ""Staying Alive"", was written and produced by Jay R Sillona and Keith Martin under Sillona's own recording label, Homeworkz Records. The song uses Auto-Tune, and features rap verses by Q-York and additional back-up vocals by beauty queen Krista Kleiner, who was Sillona's partner at the time.","Staying Alive: https://en.wikipedia.org/wiki/Staying%20Alive
Stayin' Alive: https://en.wikipedia.org/wiki/Stayin%27%20Alive",0,When did the song stayin alive by the Bee Gees come out?,13 December 1977
-7722492525558122181,Who's henry's father in once upon a time?,1,"Once Upon a Time is an American fantasy adventure drama television series that aired for seven seasons on ABC from October 23, 2011 to May 18, 2018. Henry's biological father is Neal Cassidy, played by American actor Michael Raymond-James. Henry's step-father is Killian Jones, played by Irish actor and musician Colin O'Donoghue.","Once Upon a Time is an American fantasy adventure drama television series that aired for seven seasons on ABC from October 23, 2011 to May 18, 2018.
Michael Raymond-James (born Michael Weverstad; December 24, 1977) is an American actor.
Colin Arthur O'Donoghue[1] (born 26 January 1981) is an Irish actor and musician, best known for portraying Captain Killian ""Hook"" Jones on the TV show Once Upon a Time.",List of Once Upon a Time characters: https://en.wikipedia.org/wiki/List%20of%20Once%20Upon%20a%20Time%20characters,2,Who is the character that plays henry's step-father in Once Upon a Time?,"Killian Jones, Hook"
9029874740513887001,When did the holy spirit descended upon the apostles?,1,"The Holy Spirit descended upon the apostles when they were in Jerusalem celebrating the Feast of Weeks, as described in the Acts of the Apostles, whereas we celebrate the descent on Pentecost. The Christian holy day of Pentecost is celebrated fifty days after Easter Sunday. The holiday is also known as White Sunday, Whitsunday, or Whitsun, especially in the United Kingdom.","The holiday is also called ""White Sunday"" or ""Whitsunday"" or ""Whitsun"", especially in the United Kingdom, where traditionally the next day, Whit Monday, was also a public holiday (since 1971 fixed by statute on the last Monday in May).",Pentecost: https://en.wikipedia.org/wiki/Pentecost,0,When did the holy spirit actually descend upon the apostles?,"while they were in Jerusalem celebrating the Feast of Weeks, the feast of weeks"
-2861341002123248407,Where does the united states keep an emergency stockpile of oil quizlet?,1,"The Strategic Petroleum Reserve (SPR) is a supply of petroleum held by the United States for emergency fuel and is the largest emergency supply in the world. The reserve is stored at four sites: the Bryan Mound facility in Freeport, Texas, the Big Hill facility in Winnie, Texas, the West Hackberry facility in Lake Charles, Louisiana, and the Bayou Choctaw facility in Baton Rouge, Louisiana.","The Strategic Petroleum Reserve (SPR) is a supply of petroleum held by the United States Department of Energy (DOE) for emergency fuel. It is the largest emergency supply in the world, and its underground tanks in Louisiana and Texas have capacity for 714 million barrels (113,500,000 m3).
The reserve is stored at four sites on the Gulf of Mexico, each located near a major center of petrochemical refining and processing.",Strategic Petroleum Reserve (United States): https://en.wikipedia.org/wiki/Strategic%20Petroleum%20Reserve%20%28United%20States%29,2,Where does the united states keep an emergency stockpile of oil as West Hackberry facility?,"Lake Charles, Louisiana"
1134137436027221870,Who forged the ring in lord of the rings?,0,"The One ring in The Lord of the Rings was forged by the Dark Lord Sauron, played by Sala Baker and Alan Howard in the films. The three rings for the Elves, the nine rings for men and the seven rings for the Dwarves was forged by Celebrimbor and Elven Smiths.","The Rings of Power were forged by the Elven-smiths of the Noldorin settlement of Eregion
The smiths were led by Celebrimbor, the grandson of Fëanor, the greatest craftsman of the Noldor, working with Dwarves from Khazad-dûm (Moria) led by his friend Narvi.","The Lord of the Rings: https://en.wikipedia.org/wiki/The%20Lord%20of%20the%20Rings
Rings of Power: https://en.wikipedia.org/wiki/Rings%20of%20Power
The Lord of the Rings (film series): https://en.wikipedia.org/wiki/The%20Lord%20of%20the%20Rings%20%28film%20series%29
Alan Howard: https://en.wikipedia.org/wiki/Alan%20Howard
One Ring: https://en.wikipedia.org/wiki/One%20Ring",0,Who forged the One ring in The Lord of the Rings?,Sauron
2771414991157063420,When did construction start on the sydney harbour bridge?,0,Construction of the sydney harbour bridge started on 28 July 1923 but construction of the Arch did not begin until 26 October 1928.,"The official ceremony to mark the ""turning of the first sod"" occurred on 28 July 1923, on the spot at Milsons Point on the north shore where two workshops to assist in building the bridge were to be constructed.",Sydney Harbour Bridge: https://en.wikipedia.org/wiki/Sydney%20Harbour%20Bridge,1,When did construction of the Arch start on the sydney harbour bridge?,26 October 1928
-2221108776260359894,Who played brad carlton on young and the restless?,1,"The Young and the Restless is an American television soap opera created by William J. Bell and Lee Phillip Bell for CBS. Brad Carlton is a fictional character from the CBS soap opera The Young and the Restless, portrayed by Don Diamont. In 1993, the role was temporarily recast to Russell Todd.",The Young and the Restless (often abbreviated as Y&R) is an American television soap opera created by William J. Bell and Lee Phillip Bell for CBS.,"Brad Carlton: https://en.wikipedia.org/wiki/Brad%20Carlton
Russell Todd: https://en.wikipedia.org/wiki/Russell%20Todd
The Young and the Restless: https://en.wikipedia.org/wiki/The%20Young%20and%20the%20Restless",0,Who was the main actor that played Brad Carlton on Young and the Restless?|Who played brad carlton on young and the restless regularly?,Don Diamont
-7293236077665799464,When was the this is it tour supposed to start?,1,"Michael Jackson's This Is It tour was originally supposed to start at London's O2 Arena on July 8, 2009, and after the first delay, it was supposed to start on July 13, 2009. AEG Live said the delay was necessary because more time was needed for dress rehearsals.","This Is It was a planned concert residency by American pop singer Michael Jackson, scheduled to take place at the O2 Arena, in London, between July 13, 2009 and March 6, 2010.
AEG Live said that the delay was necessary because more time was needed for dress rehearsals.",This Is It (concert residency): https://en.wikipedia.org/wiki/This%20Is%20It%20%28concert%20residency%29,1,When was the this is it tour supposed to start after the first delay?,"July 13, 2009"
4653868131958586810,What is the meaning of nat in networking?,0,"Network address translation, or NAT, is a method of remapping one IP address space into another by modifying network address information in the IP header of packets while they are in transit across a traffic routing device. The technique was originally used to avoid the need to assign a new address to every host when a network was moved, or when the upstream Internet service provider was replaced, but could not route the networks address space.","Network address translation (NAT) is a method of mapping an IP address space into another by modifying network address information in the IP header of packets while they are in transit across a traffic routing device.[1] The technique was originally used to avoid the need to assign a new address to every host when a network was moved, or when the upstream Internet service provider was replaced, but could not route the networks address space.",Network address translation: https://en.wikipedia.org/wiki/Network%20address%20translation,0,What is the meaning of nat in networking as full form?,Network address translation
-4929126693046447466,What is the name of bangalore city railway station?,0,"South Bangalore City railway station, officially Krantivira Sangolli Rayanna Benguluru Rilway Station also known as Bengaluru City railway station is the main railway station serving the city of Bangalore, Karnataka, India.","Bangalore City Railway Station, officially Krantivira Sangolli Rayanna (Bengaluru Station), also known as Bengaluru City railway station (2014–2016),[1] (station code: SBC[2]) is the main railway station serving the city of Bangalore, Karnataka, India.",Bangalore City railway station: https://en.wikipedia.org/wiki/Bangalore%20City%20railway%20station,0,What is the new name of bangalore city railway station?,"Krantivira Sangolli Rayanna Bengaluru Railway Station, Bengaluru City railway station"
-3587852235107899284,Who sings the song you got to keep your head up?,0,"The song title ""Keep Your Head Up"" has been used by various musicians. In 1993, American rapper 2Pac released a song called Keep Ya Head Up. The British girl group Girls Can't Catch released a song with the same title on July 30, 2009. The British singer-songwriter Ben Howard released a song called Keep Your Head Up on August 26, 2011 and American recording artist Andy Grammer first released a song with this same title on February 24, 2011. ","""Keep Your Head Up"" is the debut single by American recording artist Andy Grammer from his eponymous debut studio album ""Andy Grammer"" (2011).
The song was first released February 24, 2011 as the album's lead single.
""Keep Your Head Up"" is a song by British singer-songwriter Ben Howard from his debut studio album ""Every Kingdom"".
 It was released as a single in the United Kingdom on 26 August 2011 as a digital download.
""Keep Your Head Up is the debut single by British girl group Girls Can't Catch. 
It was released on 30 July 2009, and entered the UK Singles Chart at number 26. 
""Keep Ya Head Up"" is a 1993 hit single by 2Pac. 
Tupac Amaru Shakur (/ˈtuːpɑːk ʃəˈkʊər/ TOO-pahk shə-KOOR; born Lesane Parish Crooks, June 16, 1971 – September 13, 1996), better known by his stage name 2Pac and by his alias Makaveli, was an American rapper, songwriter, and actor.","Keep Ya Head Up: https://en.wikipedia.org/wiki/Keep%20Ya%20Head%20Up
Keep Your Head Up (Ben Howard song): https://en.wikipedia.org/wiki/Keep%20Your%20Head%20Up%20%28Ben%20Howard%20song%29
Keep Your Head Up (Girls Can't Catch song): https://en.wikipedia.org/wiki/Keep%20Your%20Head%20Up%20%28Girls%20Can%27t%20Catch%20song%29
Keep Your Head Up (Andy Grammer song): https://en.wikipedia.org/wiki/Keep%20Your%20Head%20Up%20%28Andy%20Grammer%20song%29",3,Who sings the song Keep Ya Head Up?,"2pac, Tupac, Tupac Amaru Shakur, Lesane Parish Crooks, Makaveli"
