sample_id,ambiguous_question,annotation_id,long_answer,knowledge,wikipages,qa_pair_id,sub_question,short_answers
125315801738591154,How many hungry jack's stores in australia?,0,"Hungry Jack's is an Australian fast-food franchise of the Burger King Corporation. It was established on April 18, 1971. The franchise had 26 locations after its first decade of business. As of 2020, there are over 400 locations in Australia. Making it the second-largest franchise of Burger King in the world.","The first Australian franchise of Burger King Corporation was established in Innaloo, Perth, on 18 April 1971, under the auspices of Cowin's new company Hungry Jack's Pty Ltd.
With over 400 locations across Australia, Hungry Jack's is the second-largest franchise of Burger King in the world (second to Carrols Corporation).","Jack Cowin: https://en.wikipedia.org/wiki/Jack%20Cowin
Hungry Jack's: https://en.wikipedia.org/wiki/Hungry%20Jack%27s
Competitive Foods Australia: https://en.wikipedia.org/wiki/Competitive%20Foods%20Australia
List of countries with Burger King franchises: https://en.wikipedia.org/wiki/List%20of%20countries%20with%20Burger%20King%20franchises",1,How many hungry jack's stores in australia as of 2020?,over 400
-2495361140136830604,When did ernie first appear on my three sons?,1,"Ernie first appeared on the sitcom My Three Sons in Episode 118 of the series, which was during Season 4, on October 31, 1963. Ernie Douglas was played by American television and film actor Barry Livingston.","My Three Sons is an American sitcom.
Barry Gordon Livingston (born December 17, 1953) is an American television and film actor, known for his role as ""Ernie Douglas"" on the television series My Three Sons (1963–72).","My Three Sons: https://en.wikipedia.org/wiki/My%20Three%20Sons
List of My Three Sons episodes: https://en.wikipedia.org/wiki/List%20of%20My%20Three%20Sons%20episodes",0,In what episode number did ernie first appear on my three sons?,118
3121525591331971729,Who played mary in the passion of christ?,1,"The Passion of the Christ is a 2004 American biblical drama film produced, co-written and directed by Mel Gibson and starring Jim Caviezel as Jesus of Nazareth, Maia Morgenstern as the Virgin Mary, and Monica Bellucci as Mary Magdalene. It depicts the Passion of Jesus largely according to the gospels of Matthew, Mark, Luke and John. The Passion is a television drama serial produced by the BBC and HBO Films in association with Deep Indigo Productions. It tells the story of the last week in the life of Jesus.  It broadcast on BBC One in four parts from 16 to 23 March 2008. In this show, Penelope Wilton played Mary, the mother of Jesus, and Paloma Baeza played Mary Magdalene.","The Passion is a television drama serial produced by the BBC and HBO Films in association with Deep Indigo Productions. It tells the story of the last week in the life of Jesus.
It was directed by Michael Offer on location in Morocco from 27 August to 23 October 2007, and broadcast on BBC One in four parts from 16 to 23 March 2008.","The Passion of the Christ: https://en.wikipedia.org/wiki/The%20Passion%20of%20the%20Christ
The Passion: New Orleans: https://en.wikipedia.org/wiki/The%20Passion%3A%20New%20Orleans
Vie et Passion du Christ: https://en.wikipedia.org/wiki/Vie%20et%20Passion%20du%20Christ
The Passion (TV serial): https://en.wikipedia.org/wiki/The%20Passion%20%28TV%20serial%29",0,"Who played Mary, mother of Jesus, in the 2004 film The Passion of the Christ?",Maia Morgenstern
5373802723357129190,Who made the song total eclipse of the heart?,1,"Several people made the song Total Eclipse of the Heart. The song was originally recorded by Welsh singer-songwriter Bonnie Tyler and released on Tyler's fifth studio album, Faster Than the Speed of Night. It was written and produced by Jim Steinman, an American composer, lyricist, record producer, and playwright who also worked as an arranger, pianist, and singer.","Bonnie Tyler (born Gaynor Hopkins, 8 June 1951)[2] is a Welsh singer-songwriter who is known for her distinctive husky voice.
James Richard Steinman (November 1, 1947 – April 19, 2021) was an American composer, lyricist, record producer, and playwright.[1] He also worked as an arranger, pianist, and singer.",Total Eclipse of the Heart: https://en.wikipedia.org/wiki/Total%20Eclipse%20of%20the%20Heart,1,"Who produced the song ""Total Eclipse of the Heart""?",Jim Steinman
-2194308568409237102,Who made it to the american idol finale?,1,"American Idol is an American singing competition television series created by Simon Fuller, produced by Fremantle North America and 19 Entertainment, and distributed by Fremantle North America. The finalists on American Idol Season 13 were Caleb Johnson and Jena Irene. The Season 14 finalists were Clark Beckham and Nick Fradiani. The Season 15 finalists were La'Porsha Renae and Trent Harmon.","American Idol is an American singing competition television series created by Simon Fuller, produced by Fremantle North America and 19 Entertainment, and distributed by Fremantle North America.","American Idol (season 12): https://en.wikipedia.org/wiki/American%20Idol%20%28season%2012%29
American Idol (season 15): https://en.wikipedia.org/wiki/American%20Idol%20%28season%2015%29",1,Who made it to the American Idol Season 14 finale?,"Nick Fradiani, Clark Beckham"
-3166192416332661165,Who played the baby in baby's day out?,0,"Adam Robert and Jacob Joseph Worton play the baby Bennington Austin ""Bink"" Cotwell IV in Baby's Day Out and Verne Troyer plays Bink's stunt double.","Adam Robert Worton and Jacob Joseph Worton as Bennington Austin ""Bink"" Cotwell IV
Verne Troyer as Bink's stunt double",Baby's Day Out: https://en.wikipedia.org/wiki/Baby%27s%20Day%20Out,1,Who played the baby in baby's day out as stunt double?,"Verne Troyer, Verne Jay Troyer"
-881464876144297194,Who played the weasley brothers in harry potter?,1,"The Weasely family is a family of wizards including Molly and Arthur Weasely as well as their seven children. Richard Fish appeared as Bill briefly in the film adaptation of Harry Potter and the Prisoner of Azkaban. Domhnall Gleeson, the son of actor Brendan Gleeson (Alastor Moody in the series), played Bill Weasley in Harry Potter and the Deathly Hallows. Chris Rankin played Percy Weasely and Fred and George Weasely were played by identical twins James Phelps and Oliver Phelps. Rupert Grint played Ron Weasely.","Arthur Weasley is the patriarch of the Weasleys, a family of wizards who are considered ""blood traitors"" by Death Eaters for their interest in the Muggle world. He is married to Molly Weasley, with whom he has seven children, including Ron, Harry's best friend.
The brothers were played by identical twins James and Oliver Phelps.[1]","List of Harry Potter characters: https://en.wikipedia.org/wiki/List%20of%20Harry%20Potter%20characters
List of supporting Harry Potter characters: https://en.wikipedia.org/wiki/List%20of%20supporting%20Harry%20Potter%20characters
List of Harry Potter cast members: https://en.wikipedia.org/wiki/List%20of%20Harry%20Potter%20cast%20members
Order of the Phoenix (fictional organisation): https://en.wikipedia.org/wiki/Order%20of%20the%20Phoenix%20%28fictional%20organisation%29",0,Who played  Bill weasley in Harry Potter and the Prisoner of Azkaban?,Richard Fish
5449635938213138177,Vikram samvat is official calendar of which contry?,0,"Vikram Samvat or Bikram Sambat and also known as the Vikrami calendar, is the historical Hindu calendar used in some but not all states of the Indian subcontinent. It is also the official calendar of Nepal.",[NO_KNOWLEDGE_AVAILABLE],"India: https://en.wikipedia.org/wiki/India
Vikram Samvat: https://en.wikipedia.org/wiki/Vikram%20Samvat",1,Vikram samvat is official calendar in some but not all states of which contry?,"Republic of India, India"
-6502702531638979425,Who is known as the father of toxicology?,1,"Mathieu Orfila is considered the modern father of toxicology, having given the subject its first formal treatment in 1813 in his ""Traité des poisons"", also called ""Toxicologie générale"". Also credited as the father of toxicology is Paracelsus, born Theophrastus von Hohenheim, full name Philippus Aureolus Theophrastus Bombastus von Hohenheim, who was a Swiss physician, alchemist, lay theologian, and philosopher of the German Renaissance. He was a pioneer in several aspects of the ""medical revolution"" of the Renaissance, emphasizing the value of observation in combination with received wisdom. ","Paracelsus (/ˌpærəˈsɛlsəs/; c. 1493[1] – 24 September 1541), born Theophrastus von Hohenheim (full name Philippus Aureolus Theophrastus Bombastus von Hohenheim[10][11]), was a Swiss[12] physician, alchemist, lay theologian, and philosopher of the German Renaissance.[13][14]
He was a pioneer in several aspects of the ""medical revolution"" of the Renaissance, emphasizing the value of observation in combination with received wisdom. He is credited as the ""father of toxicology"".","Paracelsus: https://en.wikipedia.org/wiki/Paracelsus
Toxicology: https://en.wikipedia.org/wiki/Toxicology",0,"Who is known as the father of toxicology with Traité des poisons, also called Toxicologie générale?",Mathieu Orfila
2416330318995122750,What is the name of the tower big ben is in?,1,"The original official name of the tower Big Ben is in was the Clock Tower, but it was renamed in 2012 to mark the Diamond Jubilee of Elizabeth II, and its name has been Elizabeth Tower since 2012.",[NO_KNOWLEDGE_AVAILABLE],"Palace of Westminster: https://en.wikipedia.org/wiki/Palace%20of%20Westminster
Big Ben: https://en.wikipedia.org/wiki/Big%20Ben",2,What is the name of the tower big ben is in since 2012?,"The Elizabeth Tower, Elizabeth Tower"
-5260425935346363678,What episode of dark angel is jensen ackles in?,0,"Jensen Ackles plays Ben in Episode 18 of Dark Angel titled ""Pollo Loco"".",[NO_KNOWLEDGE_AVAILABLE],"List of Dark Angel episodes: https://en.wikipedia.org/wiki/List%20of%20Dark%20Angel%20episodes
Jensen Ackles: https://en.wikipedia.org/wiki/Jensen%20Ackles",3,What episode name of dark angel is jensen ackles in?,"""Pollo Loco"""
3399525087413728510,Was the memphis belle the first to complete 25 missions?,1,"Memphis Belle is a Boeing B-17F Flying Fortress used during the Second World War. The aircraft was one of the first United States Army Air Forces B-17 heavy bombers to complete 25 combat missions, but no, it was not the first. Hell's Angels of the 303rd Bomb Group completed 25 combat missions on 13 May 1943, becoming the first B-17 to complete the feat, one week before the Memphis Belle.",[NO_KNOWLEDGE_AVAILABLE],"303rd Air Expeditionary Group: https://en.wikipedia.org/wiki/303rd%20Air%20Expeditionary%20Group
Memphis Belle (aircraft): https://en.wikipedia.org/wiki/Memphis%20Belle%20%28aircraft%29
Hell's Angels (film): https://en.wikipedia.org/wiki/Hell%27s%20Angels%20%28film%29
Hot Stuff (aircraft): https://en.wikipedia.org/wiki/Hot%20Stuff%20%28aircraft%29",2,Was the memphis belle the first B-17 to complete 25 missions?,"one of the first, no, Hell's Angels (41-24577) of the 303rd Bomb Group completed 25 combat missions on 13 May 1943, becoming the first B-17 to complete the feat, one week before the Memphis Belle"
-5700241817712358648,The only child of a president to be born in the whitehouse?,1,"Grover Cleveland was the only president to have a child born in the White House. The name of his child was Esther Cleveland, who was born on September 9, 1893.","Esther Cleveland (September 9, 1893 – June 25, 1980) was the second child of Grover Cleveland, 22nd and 24th President of the United States, and his wife Frances Folsom Cleveland.",Esther Cleveland: https://en.wikipedia.org/wiki/Esther%20Cleveland,1,Who is the only child of a president born in the White House?,Esther Cleveland
3551793800275335777,Who played wicked witch of the west in oz?,1,"The Wicked Witch of the West has been played a number of times. The character was played by Margaret Hamilton in the 1939 film The Wizard of Oz, by Mila Kunis in the 2013 film Oz the Great and Powerful, by Debra Winger in the 1995 television special The Wizard of Oz in Concert: Dreams Come True, and by Eliza Swenson in the 2011 television miniseries Dorothy and the Witches of Oz.","The Wicked Witch of the West is a fictional character who appears in the classic children's novel The Wonderful Wizard of Oz (1900), created by American author L. Frank Baum.
Margaret Brainard Hamilton (December 9, 1902 – May 16, 1985) was an American film actress best known for her portrayal of the Wicked Witch of the West, and her Kansas counterpart Almira Gulch, in Metro-Goldwyn-Mayer's film The Wizard of Oz (1939).","Oz (TV series): https://en.wikipedia.org/wiki/Oz%20%28TV%20series%29
Oz: https://en.wikipedia.org/wiki/Oz",0,Who played wicked witch of the west in the 2013 film oz the great and powerful?,"Mila Kunis, Milena Markovna ""Mila"" Kunis"
2460950840947172152,Who's won the most premierships in afl?,0,"The Australian Football League (AFL) formerly known as the Victorian Football League (VFL) is made up of a men's division, men's reserves, men's under-19 and a women's premiership side as well. The men's clubs Carlton and Essendon, have won the most premierships. The most men's reserves side, Melbourne has won the most in the reserves category. The most under-19 men's premierships have been won by Richmond and finally, the most number of premiership wins on the women's side have been won by Adelaide.","The Australian Football League (AFL), known as the Victorian Football League (VFL) until 1990, is the elite national competition in men's Australian rules football.","List of VFL/AFL premiers: https://en.wikipedia.org/wiki/List%20of%20VFL/AFL%20premiers
VFL/AFL premiership and grand final statistics: https://en.wikipedia.org/wiki/VFL/AFL%20premiership%20and%20grand%20final%20statistics",1,Who's won the most men's reserves premierships in vfl/afl?,Melbourne
8902104855469910963,Who got stuck in the belly of a whale?,0,"There are several stories of people being stuck in the belly of a whale. Jonah, a prophet of the northern kingdom of Israel in about the 8th century BCE, got caught in a storm whereupon he is swallowed by a giant fish. James Bartley was the central figure in a late nineteenth-century story according to which he was swallowed whole by a sperm whale. In the film Mind Game, Yan, Nishi, Myon and old man got stuck in the belly of whale. In Pinocchio, Geppetto had ventured out to sea to save Pinocchio from Pleasure Island, but was swallowed by a terrible giant whale named Monstro.",[NO_KNOWLEDGE_AVAILABLE],"Blood Money (Tom Waits album): https://en.wikipedia.org/wiki/Blood%20Money%20%28Tom%20Waits%20album%29
Pinocchio (1940 film): https://en.wikipedia.org/wiki/Pinocchio%20%281940%20film%29
Mind Game (film): https://en.wikipedia.org/wiki/Mind%20Game%20%28film%29
James Bartley: https://en.wikipedia.org/wiki/James%20Bartley
The Mariner's Revenge Song: https://en.wikipedia.org/wiki/The%20Mariner%27s%20Revenge%20Song
Jonah: https://en.wikipedia.org/wiki/Jonah",2,Who got stuck in the belly of a whale in the film Mind Game?,"Yan, old man, Nishi, Myon"
8363490501399084298,When did they start filming guardians of the galaxy?,0,"There are currently two Guardians of the Galaxy movies, Vol. 1 and Vol. 2. A third one is expected in 2023. Filming of the first movie in the series took place on July 6, 2013 in London. Pre-shooting for Vol.2 started on February 11, 2016 in Georgia, and principle photography started on  February 17, 2016.","The sequel, Guardians of the Galaxy Vol. 3, will be released on May 5, 2023.
Principal photography began around July 6, 2013 in London, United Kingdom,[56] under the working title of Full Tilt.","Guardians of the Galaxy (TV series): https://en.wikipedia.org/wiki/Guardians%20of%20the%20Galaxy%20%28TV%20series%29
Guardians of the Galaxy: https://en.wikipedia.org/wiki/Guardians%20of%20the%20Galaxy
Guardians of the Galaxy Vol. 2: https://en.wikipedia.org/wiki/Guardians%20of%20the%20Galaxy%20Vol.%202",3,When did they start filming the 2014 film guardians of the galaxy?,"July 6, 2013, around July 6, 2013"
8630912480840635425,Why did the st louis cardinals move to arizona?,0,"On March 15, 1988, the NFL team owners voted to allow Bidwill to move the Cardinals from St. Louis to Tempe, Arizona for the 1988 NFL season due to the overall mediocrity of the Cardinals, combined with an old stadium, which caused game attendance to dwindle.","On March 15, 1988, the NFL team owners voted to allow Bidwill to move the Cardinals from St. Louis to Tempe, Arizona for the 1988 NFL season.","History of the St. Louis Cardinals (NFL): https://en.wikipedia.org/wiki/History%20of%20the%20St.%20Louis%20Cardinals%20%28NFL%29
History of the Arizona Cardinals: https://en.wikipedia.org/wiki/History%20of%20the%20Arizona%20Cardinals",0,What ability caused the st louis cardinals move to arizona?,overall mediocrity of the Cardinals
422810910814179234,Who wrote the song don't give up on me?,0,"The phrase, “Don’t give up on me”, is a popular title for music. Andy Grammer wrote the song, ""Don't Give Up on Me"", for his fourth studio album. Grammer, Bram Inscore, Torrey, and Sam Farrar are all listed as writers for the song. Dan Penn, Carson Whitsett, Hoy Lindsey wrote a song called ""Don't Give up on Me"" also, and it was released in 2002. American R&B/Soul singer Solomon Burke named his studio album, ""Don't Give Up on Me"", with the title track written by Dan Penn and Carson Whitsett with Hoy Lindsey.","Don't Give Up on Me is an album by Solomon Burke, or the title song. ""Don't Give Up on Me"" may also refer to: ""Don't Give Up on Me"" (Kill the Noise and Illenium song), 2018, Don't Give Up on Me Now, 2011 single by Ben Harper, ""Don't Give Up on Me"", 2017 song from the Take That album, Wonderland, ""Touchdown Turnaround (Don't Give Up on Me)"", a song from the 2006 debut album titled Zombies! Aliens! Vampires! Dinosaurs!","Andy Grammer: https://en.wikipedia.org/wiki/Andy%20Grammer
Don't Give Up on Me (disambiguation): https://en.wikipedia.org/wiki/Don%27t%20Give%20Up%20on%20Me%20%28disambiguation%29
Don't Give Up on Me: https://en.wikipedia.org/wiki/Don%27t%20Give%20Up%20on%20Me
Naive (Andy Grammer album): https://en.wikipedia.org/wiki/Naive%20%28Andy%20Grammer%20album%29
Don't Give Up on Us (song): https://en.wikipedia.org/wiki/Don%27t%20Give%20Up%20on%20Us%20%28song%29",3,"Who wrote the Solomon Burke song ""Don't Give Up On Me""?",Dan Penn and Carson Whitsett with Hoy Lindsey
-931393027586080080,When did the redskins go to the superbowl?,1,"The Washington Football Team, the team formerly known as the Washington Redskins, has played over 1,000 games. In those games, the club has won five professional American football championships including two NFL Championships and three Super Bowls. The franchise has also captured 15 NFL divisional titles and five NFC championships. The Redskins went to Superbowl XVIII on January 22, 1984 but lost to the Los Angeles Raiders. The Redskins won their second championship in Superbowl XXII on January 31, 1988, in San Diego, California against the Denver Broncos. On January 26, 1992, the Redskins won Superbowl XXVI by defeating the Buffalo Bills 37–24.","The Washington Football Team, the team formerly known as the Washington Redskins, has played over 1,000 games. In those games, the club has won five professional American football championships including two NFL Championships and three Super Bowls. The franchise has also captured 15 NFL divisional titles and five NFC championships.[1]
It was their final win of the season because two weeks later, the Los Angeles Raiders beat the Redskins 38–9 in Super Bowl XVIII.[29]","History of the Washington Redskins: https://en.wikipedia.org/wiki/History%20of%20the%20Washington%20Redskins
Washington Redskins: https://en.wikipedia.org/wiki/Washington%20Redskins",5,When is the edition did the redskins go to the superbowl in 1988?,"Superbowl XXII, Superbowl 22"
4736010675551913156,When did the lion king debut on broadway?,1,"The Lion King opened on Broadway more than once. It premiered on Broadway at the New Amsterdam Theatre in previews on October 15, 1997, then officially opened on Broadway on November 13, 1997. On June 13, 2006, the Broadway production moved to the Minskoff Theatre, another Broadway theater, where it is still running after more than 9,000 performances.","The Minskoff Theatre is a Broadway theatre, located at 1515 Broadway in Times Square in Midtown Manhattan in New York City.",The Lion King (musical): https://en.wikipedia.org/wiki/The%20Lion%20King%20%28musical%29,0,When did The Lion King preview premier on Broadway?,"October 15, 1997"
4650240478947189358,Who played in the super bowl in 2013?,0,Super Bowl XLVII was an American football game between the Baltimore Ravens and the San Francisco 49ers to decide the National Football League (NFL) champion for the 2012 season. The halftime show for the game was preformed by Beyoncé with special guests Kelly Rowland and Michelle Williams.,Beyoncé headlined with special guests Kelly Rowland and Michelle Williams from Destiny's Child.,"Super Bowl XLVII halftime show: https://en.wikipedia.org/wiki/Super%20Bowl%20XLVII%20halftime%20show
Super Bowl XLVII: https://en.wikipedia.org/wiki/Super%20Bowl%20XLVII",0,Who from AFC played in the super bowl in 2013?,Baltimore Ravens
1040777011551693796,Who presides over the joint session of the indian parliament?,0,"The Parliament of India has a joint sitting of the Parliament that is called by the President of India (Article 108) and is presided over by the Speaker of the Lok Sabha or, in his absence, by the Deputy Speaker of the Lok Sabha or in his absence, the Deputy-Chairman of the Rajya Sabha.","The joint sitting of the Parliament is called by the President of India (Article 108) and is presided over by the Speaker of the Lok Sabha or, in their absence, by the Deputy Speaker of the Lok Sabha, or in their absence, the Deputy Chairman of the Rajya Sabha.",Joint Session of the Parliament of India: https://en.wikipedia.org/wiki/Joint%20Session%20of%20the%20Parliament%20of%20India,4,Who presides over the joint session of the indian parliament if the speaker is absent?,Deputy Speaker of the Lok Sabha
-7856526841607636298,When does the new family guy season come out?,0,"Family Guy Season 14 aired on September 27, 2015. Season 15 aired on September 25, 2016 and Season 16 aired on October 1, 2017.",[NO_KNOWLEDGE_AVAILABLE],"Family Guy (season 15): https://en.wikipedia.org/wiki/Family%20Guy%20%28season%2015%29
Family Guy (season 17): https://en.wikipedia.org/wiki/Family%20Guy%20%28season%2017%29
Family Guy: https://en.wikipedia.org/wiki/Family%20Guy
Family Guy (season 14): https://en.wikipedia.org/wiki/Family%20Guy%20%28season%2014%29
Family Guy (season 16): https://en.wikipedia.org/wiki/Family%20Guy%20%28season%2016%29",1,When does family guy season 15 come out?,"September 25, 2016"
-6359539096826078233,When was the first piece of music made?,0,"The history of music covers the historical development and evolution of music from prehistoric times to present day. The ""oldest known song"" was written in cuneiform, dating to 3400 years ago from Ugarit in Syria. The first piece of unwritten music was made prior to the Paleolithic age 3.3 million years ago. ",The history of music covers the historical development and evolution of music from prehistorical times to present day. ,History of music: https://en.wikipedia.org/wiki/History%20of%20music,1,When was the first piece of written music made?,3400 years ago
-8180011246386869658,How many episodes are there in season 2 of the shannara chronicles?,0,"The Shannara Chronicles is an American fantasy drama television series created by Alfred Gough and Miles Millar. It aired between January 5, 2016, and November 22, 2017. Starting November 8, the series would release 2 episodes per week, beginning with episodes 5 and 6. The following week on November 15, episodes 7 and 8 were released, and finally on November 22, the series concluded with episodes 9 and 10 being released.","The Shannara Chronicles is an American fantasy drama television series created by Alfred Gough and Miles Millar. 
The first season of The Shannara Chronicles premiered on MTV in the United States on January 5, 2016, and consisted of 10 episodes. MTV originally greenlit a second season in April 2016; however, in May 2017, it was announced that the series would relocate to Spike (now Paramount Network). The second season premiered on October 11, 2017, and concluded November 22, 2017. ",The Shannara Chronicles: https://en.wikipedia.org/wiki/The%20Shannara%20Chronicles,2,"How many episodes are there in season 2 of the shannara chronicles as of November 8, 2017?",6
6986614780487265984,Who does corbin bleu play in high school musical?,0,Corbin Bleu starred as Chad Danforth in all three of the High School Musical films.,[NO_KNOWLEDGE_AVAILABLE],Corbin Bleu: https://en.wikipedia.org/wiki/Corbin%20Bleu,0,Who does corbin bleu play in the 2006 high school musical film?,"Chad Danforth, Chad, Danforth"
4173446972612181668,When was the spy who dumped me released?,1,"The Spy Who Dumped Me is a 2018 American black comedy/spy thriller film directed by Susanna Fogel and co-written by Fogel and David Iserson. ""The Spy Who Dumped Me"" premiered at Regency Village Theater in Los Angeles on July 25, 2018. The film was released in the United States on August 3, 2018, by Lionsgate and grossed more than $75 million, while receiving mixed reviews from critics, who questioned the film's intended genre and tone but praised the performances.",[NO_KNOWLEDGE_AVAILABLE],The Spy Who Dumped Me: https://en.wikipedia.org/wiki/The%20Spy%20Who%20Dumped%20Me,2,When was the spy who dumped me released in Los Angeles?,"July 25, 2018"
