sample_id,ambiguous_question,annotation_id,long_answer,knowledge,wikipages,qa_pair_id,sub_question,short_answers
6087617540935009990,When does halley's comet come back around?,1,"Halley's Comet or Comet Halley, officially designated 1P/Halley, is a short-period comet visible from Earth every 75–76 years. Halley last appeared in the inner parts of the Solar System in 1986 and will come back around in mid-2061 to 2062.","Halley's Comet or Comet Halley, officially designated 1P/Halley,[2] is a short-period comet visible from Earth every 75–76 years.[2][10][11][12]
Halley last appeared in the inner parts of the Solar System in 1986 and will next appear in mid-2061.[14]",Halley's Comet: https://en.wikipedia.org/wiki/Halley%27s%20Comet,2,When is the period does halley's comet come back around?,every 75–76 years
6198433147510073269,Who produced toni braxton just be a man about it?,0,Teddy Bishop was the main producer for Toni Braxton’s “Just Be a Man About It.” A telephone breakup song which Toni Braxton and Bryan-Michael Cox co-produced. ,"""Just Be a Man About It"" is a telephone breakup song, where Braxton questions the status of a partner's manhood and Dr. Dre plays the wayward lover breaking the news to her.",Just Be a Man About It: https://en.wikipedia.org/wiki/Just%20Be%20a%20Man%20About%20It,3,"Who were the co producers of Toni Braxton's ""Just Be a Man""?","Toni Braxton, Bryan-Michael Cox"
5650367261587015274,When did pakistan won olympic gold medal in hockey for the first time?,0,"Pakistan won their first Olympic gold medal in field hockey on September 9, 1960 in Rome. They won their second Olympic gold medal in Mexico City in the 1968 Summer Olympics and their 3rd Olympic Gold Medal in Los Angeles in 1984. Pakistan is the most successful national field hockey team in the Hockey World Cup with four championships: 1971, 1978, 1982 and 1994.  However, Pakistan has not qualified for the Olympics since 2012.",[NO_KNOWLEDGE_AVAILABLE],"Pakistan at the Olympics: https://en.wikipedia.org/wiki/Pakistan%20at%20the%20Olympics
Pakistan men's national field hockey team: https://en.wikipedia.org/wiki/Pakistan%20men%27s%20national%20field%20hockey%20team",0,When did Pakistan win an Olympic gold medal in men's field hockey for the second time?,1968
-2028008768314817948,Who is elected as the vice president of india?,0,"The second highest constitutional office or the position of Vice President in India was held by Bhairon Singh Shekhawat from August 2002 until he resigned on 21 July 2007. From 2007 to 2017, Mohammad Hamid Ansari served two terms as the 12th Vice President after his re-appointment in 2012. On 11 August 2017, the Vice President seat was then held by Venkaiah Naidu after being sworn in as the 13th vice president of the country.  ","Bhairon Singh Shekhawat (23 October 1925 – 15 May 2010) was the 11th Vice President of India
He served in that position from August 2002, when he was elected to a five-year term by the electoral college following the death of Krishan Kant, until he resigned on 21 July 2007, after losing the presidential election to Pratibha Patil.
Mohammad Hamid Ansari (About this soundpronunciation (help·info); born 1 April 1937) is an Indian politician and retired Foreign service officer who was the 12th Chairman of Rajya Sabha and 12th Vice President of India from 2007 to 2017.
His second term ended in August 2017 since he was not offered another term, he decided not to run for a third term in the 2017 vice-presidential election.
In 2012 Vice presidential election, the Congress-led UPA re-appointed Ansari as their candidate for the post of VP. ","List of vice presidents of India: https://en.wikipedia.org/wiki/List%20of%20vice%20presidents%20of%20India
Vice President of India: https://en.wikipedia.org/wiki/Vice%20President%20of%20India",3,Who was elected as the Vice President of India in 2017?,Venkaiah Naidu
-7035938730030199426,Who used to be on the five on fox?,0,"Bob Beckel, Andrea Tantaros, Eric Bolling, Kimberly Guilfoyle were the former hosts of ""The Five"" on Fox News. Robert ""Bob"" Beckel left ""The Five"" on Fox News. Andrea Tantaros left ""The Five"" on April 25, 2016 indefinitely. Eric Bolling left ""The Five"" on Fox News in April 2017. Kimberly Guilfoyle left ""The Five"" on Fox News in 2018.",[NO_KNOWLEDGE_AVAILABLE],"Jesse Watters: https://en.wikipedia.org/wiki/Jesse%20Watters
The Five (talk show): https://en.wikipedia.org/wiki/The%20Five%20%28talk%20show%29
Juan Williams: https://en.wikipedia.org/wiki/Juan%20Williams",0,"Who are the former hosts of ""The Five"" on Fox News?","Bob Beckel, Andrea Tantaros, Eric Bolling, Kimberly Guilfoyle, Bob Beckel, Andrea Tantaros, Eric Bolling, and Kimberly Guilfoyle, Beckel, Tantaros, Bolling, Guilfoyle"
-4851598933373440850,When did jackie robinson retire from the brooklyn dodgers?,0,"Jackie Robinson ended his major league career when he struck out to end Game 7 of the 1956 World Series on October 10, 1956. He officially retired from the Brooklyn Dodgers at 37 years old on January 5, 1957.",[NO_KNOWLEDGE_AVAILABLE],Jackie Robinson: https://en.wikipedia.org/wiki/Jackie%20Robinson,4,When was Jackie Robinson's retirement from the Brooklyn Dodgers?,"October 10, 1956, 1956, after the 1956 season"
8600407550125901057,How many seats are there in the parliament of ghana?,1,"The legislative body of Ghana's government, the Parliament of Ghana, has had 275 seats since 2012, while it had 104 seats in 1954 and 1970, 140 seats in 1969, 200 seats in 1992, and 230 seats in 2004.",The Parliament of Ghana is the legislative body of the Government of Ghana.,Parliament of Ghana: https://en.wikipedia.org/wiki/Parliament%20of%20Ghana,5,"How many seats are there in the parliament of ghana, since 2012?",275
-2636605142286822139,When does master chef junior start in 2018?,1,"There are several MasterChef Junior series. MasterChef Junior started in January 2018 in Ukraine. MasterChef Junior started on March 2, 2018 in America and on March 27, 2018 in Albania.It started on August 19, 2018 in Thailand and September 13, 2018 in Greece.",[NO_KNOWLEDGE_AVAILABLE],"Junior MasterChef Australia: https://en.wikipedia.org/wiki/Junior%20MasterChef%20Australia
Junior MasterChef: https://en.wikipedia.org/wiki/Junior%20MasterChef
MasterChef Junior Thailand: https://en.wikipedia.org/wiki/MasterChef%20Junior%20Thailand
MasterChef Junior Albania: https://en.wikipedia.org/wiki/MasterChef%20Junior%20Albania
MasterChef Junior (American season 6): https://en.wikipedia.org/wiki/MasterChef%20Junior%20%28American%20season%206%29
Junior MasterChef Greece: https://en.wikipedia.org/wiki/Junior%20MasterChef%20Greece
MasterChef (American TV series): https://en.wikipedia.org/wiki/MasterChef%20%28American%20TV%20series%29
MasterChef Junior (American season 7): https://en.wikipedia.org/wiki/MasterChef%20Junior%20%28American%20season%207%29
MasterChef Junior (Brazilian TV series): https://en.wikipedia.org/wiki/MasterChef%20Junior%20%28Brazilian%20TV%20series%29",4,When does master chef junior start in 2018 in Ukraine?,January 2018
5621684038737486499,What family does paris belong to in romeo and juliet?,1,"William Shakespeare's play ""Romeo and Juliet"" contains a relatively distinctive cast of characters. In addition to the play's eponymous protagonists, Romeo Montague and Juliet Capulet, the play contains roles for members of their respective families and households. Prince Escalus, the city's ruler, and his kinsman, Count Paris are both members of the House of Escalus. Mercutio, also in the House of Escalus, is not a member of the royal family but supports and fights on the Montague side of the feud.","House of Escalus
Prince Escalus
Count Paris
Mercutio","Characters in Romeo and Juliet: https://en.wikipedia.org/wiki/Characters%20in%20Romeo%20and%20Juliet
Count Paris: https://en.wikipedia.org/wiki/Count%20Paris",0,What royal family member does paris belong to in romeo and juliet?,Prince Escalus
318044511055681208,Who played alan turner's son in emmerdale?,1,"More than one person played Terence Turner, Alan Turner's son on the British ITV soap opera Emmerdale. Actor Stephen Marchant played the character in 1985, debuting on-screen as Terence in April 1985. On 9 December 2005, it was announced that Terence would be returning to the serial, with Nick Brimble taking over the role. Brimble played Terence until the character's death in 2006.","Actor Stephen Marchant debuted on-screen as Terence in April 1985.
On 9 December 2005, It was announced that Terence would be returning to the serial, with Nick Brimble taking over the role.","Terence Turner: https://en.wikipedia.org/wiki/Terence%20Turner
Alan Turner (Emmerdale): https://en.wikipedia.org/wiki/Alan%20Turner%20%28Emmerdale%29",2,Who played alan turner's son in emmerdale in 1985?,Stephen Marchant
5780388869788119926,Who is the current chairman of african union commission?,0,"The 4th chairman of the African Union Commission is Moussa Faki Mahamat, who became chairman in 2017. Before him was chairman Nkosazana Clarice Dlamini-Zuma starting as the 3rd in 2012. Nkosazana replaced the 2nd chairman, Jean Ping who started as chairman in 2008. ",[NO_KNOWLEDGE_AVAILABLE],"Chairperson of the African Union Commission: https://en.wikipedia.org/wiki/Chairperson%20of%20the%20African%20Union%20Commission
African Union Commission: https://en.wikipedia.org/wiki/African%20Union%20Commission",0,Who is the 4th chairman of african union commission?,"Moussa Faki, Moussa Faki Mahamat"
-8163860826799817667,Who won the battle of blackburn's ford?,1,"The Battle of Blackburn's Ford was a battle in the American Civil War that occurred on July 18, 1861 when the Union army met Confederate forces while marching towards the Confederate capital of Richmond, Virginia. The Confederacy won this battle with the Confederate Army of the Potomac, led by Brig. Gen. P. G. T. Beauregard.","The Battle of Blackburn's Ford (also known as the Skirmish at Blackburn's Ford)[2] took place on July 18, 1861, in the Confederate state of Virginia, as part of the Manassas campaign of the American Civil War. Union general Irvin McDowell's Army of Northeastern Virginia was marching south towards the Confederate capitol of Richmond, and encountered the Confederate Army of the Potomac under the command of P. G. T. Beauregard",Battle of Blackburn's Ford: https://en.wikipedia.org/wiki/Battle%20of%20Blackburn%27s%20Ford,0,Which country won the battle of blackburn's ford?,"CSA, Confederacy, C.S., Confederate States of America"
-3469572554119413466,Who was the greatest warrior for the trojans?,0,"In Greek and Roman mythology, Hector was a Trojan prince and the greatest warrior for Troy in the Trojan War. ",[NO_KNOWLEDGE_AVAILABLE],"List of Trojan War characters: https://en.wikipedia.org/wiki/List%20of%20Trojan%20War%20characters
Hector: https://en.wikipedia.org/wiki/Hector",1,What was the position of the greatest warrior for the trojans?,prince
531835759431685810,Who produced the ten commandments of computer ethics?,1,"The Ten Commandments of Computer Ethics were created in 1992 by the Computer Ethics Institute. The commandments were introduced in the paper ""In Pursuit of a 'Ten Commandments' for Computer Ethics"" by Ramon C. Barquin as a means to create ""a set of standards to guide and instruct people in the ethical use of computers.""",[NO_KNOWLEDGE_AVAILABLE],Ten Commandments of Computer Ethics: https://en.wikipedia.org/wiki/Ten%20Commandments%20of%20Computer%20Ethics,1,Which person produced the ten commandments of computer ethics?,Ramon C. Barquin
-3492518758992084885,Who gets mandy pregnant in season 2 of shameless?,0,"There is a British and an American version of the show ""Shameless."" In season 2 of each version, Mandy becomes pregnant. In the American version, Terry Milkovich, her own father impregnated her while he was drunk. Terry is played by actor Dennis Cockrum. However, in the British version, Lip as the father of Mandy's baby. Jody Latham plays the role of Lip in the British version of the show.",Lip and Ian learn the true identity of the father of Mandy's baby–her own father impregnated her while he was drunk.,"Shameless (season 2): https://en.wikipedia.org/wiki/Shameless%20%28season%202%29
List of Shameless (British TV series) episodes: https://en.wikipedia.org/wiki/List%20of%20Shameless%20%28British%20TV%20series%29%20episodes",2,Which character gets mandy pregnant in season 2 of the American show shameless?,Terry Milkovich
-4217433867539652706,What state is directly west of north dakota?,0,"Montana is the state directly west of North Dakota. Idaho is further west of both North Dakota and Montana, followed by Oregon and Washington being the furthest west of North Dakota. ",[NO_KNOWLEDGE_AVAILABLE],North Dakota: https://en.wikipedia.org/wiki/North%20Dakota,0,What state is the closest state directly west of north dakota?,Montana
-3346585405026933671,What is the meaning of the latin word camera obscura?,0,"A camera obscura, from the Latin word camera obscūra or ""dark chamber"", is a darkened room with a small hole or lens at one side through which an image is projected onto a wall or table opposite the hole. A camera obscura without a lens but with a very small hole is sometimes referred to as a pinhole camera or pinhole image, although this more often refers to simple (homemade) lensless cameras where photographic film or photographic paper is used.","A camera obscura (plural camerae obscurae or camera obscuras, from Latin camera obscūra, ""dark chamber"")[1] is a darkened room with a small hole or lens at one side through which an image is projected onto a wall[2][3] or table[4] opposite the hole.[2][3]
A camera obscura without a lens but with a very small hole is sometimes referred to as a pinhole camera, although this more often refers to simple (homemade) lensless cameras where photographic film or photographic paper is used.",Camera obscura: https://en.wikipedia.org/wiki/Camera%20obscura,0,What is the literal meaning of the latin word camera obscura?,dark chamber
5325575868986432678,When is the last time georgia bulldogs won the sec championship?,1,"The Georgia Bulldogs football team, from the University of Georgia, compete in the Football Bowl Subdivision of the National Collegiate Athletic Association, and the Eastern Division of the Southeastern Conference, or SEC. The Bulldogs have won the SEC Championship Game multiple times, more recently on December 2, 2017 and December 3, 2005.","The SEC Championship Game is an annual American football game that has determined the Southeastern Conference's season champion since 1992.
While ten SEC members have played in the game, only six have won: Florida, Georgia, and Tennessee of the East Division, and Alabama, Auburn, and LSU of the West Division. Each of these teams has won the championship multiple times.
The Georgia Bulldogs football program represents the University of Georgia in the sport of American football. The Bulldogs compete in the Football Bowl Subdivision (FBS) of the National Collegiate Athletic Association (NCAA) and the Eastern Division of the Southeastern Conference (SEC).",SEC Championship Game: https://en.wikipedia.org/wiki/SEC%20Championship%20Game,4,"As of 2016, when was the last time the Georgia Bulldogs won the SEC championship?",2005
-2138294266173392605,Who plays the mom in bob's burgers?,0,"Bob's Burgers is an American adult animated sitcom created by Loren Bouchard for the Fox Broadcasting Company. Some of the voice actors featured in the show are John Roberts as Linda, Renée Taylor as Gloria (Linda's mother), Lindsey Stoddart as the mother of Logan Barry Bush, and Wendi McLendon-Covey as Mudflap.",Bob's Burgers is an American adult animated sitcom created by Loren Bouchard for the Fox Broadcasting Company.,List of Bob's Burgers characters: https://en.wikipedia.org/wiki/List%20of%20Bob%27s%20Burgers%20characters,0,Who plays Linda in Bobs Burgers?,John Roberts
-3072146511895791249,When did the draft began for the vietnam war?,0,"The draft for the Vietnam War started in France in 1954, in China in 1962 and in the United States on December 1, 1969. ","The Vietnam War (Vietnamese: Chiến tranh Việt Nam), also known as the Second Indochina War,[59] was a conflict in Vietnam, Laos, and Cambodia from 1 November 1955[A 1] to the fall of Saigon on 30 April 1975.","Vietnam War: https://en.wikipedia.org/wiki/Vietnam%20War
Draft lottery (1969): https://en.wikipedia.org/wiki/Draft%20lottery%20%281969%29",0,When did the draft began for the vietnam war in United States?,"December 1, 1969"
-7368635515365513931,What's the famous street in new orleans?,0,"There are two historically famous streets in the city of New Orleans. Bourbon Street is a street in the heart of the French Quarter of New Orleans. Extending thirteen blocks from Canal Street to Esplanade Avenue, Bourbon Street is famous for its many bars and strip clubs. Canal Street is a major thoroughfare in the city of New Orleans. Forming the upriver boundary of the city's oldest neighborhood, the French Quarter or Vieux Carré, it served historically as the dividing line between the colonial-era (18th-century) city and the newer American Sector, today's Central Business District.",[NO_KNOWLEDGE_AVAILABLE],"New Orleans: https://en.wikipedia.org/wiki/New%20Orleans
Bourbon Street: https://en.wikipedia.org/wiki/Bourbon%20Street
List of streets of New Orleans: https://en.wikipedia.org/wiki/List%20of%20streets%20of%20New%20Orleans
Canal Street, New Orleans: https://en.wikipedia.org/wiki/Canal%20Street%2C%20New%20Orleans",0,What's the famous street in new orleans known for bars and strip clubs?,Bourbon Street
5373802723357129190,Who made the song total eclipse of the heart?,0,"""Total Eclipse of the Heart"" is a song recorded by Welsh singer Bonnie Tyler. It was written and produced by Jim Steinman, and released in 1983 on Tyler's fifth studio album, ""Faster Than the Speed of Night"". The song was released as a single by Columbia Records on 11 February 1983 in the United Kingdom and on 31 May 1983 in the United States.",[NO_KNOWLEDGE_AVAILABLE],Total Eclipse of the Heart: https://en.wikipedia.org/wiki/Total%20Eclipse%20of%20the%20Heart,4,"Who wrote the song ""Total Eclipse of The Heart""?",Jim Steinman
2215574890678862752,Who came up with a cure for tuberculosis?,0,"In the quest to find a cure for tuberculosis, several methods have been developed overtime. The surgical intervention, pneumothorax, which is the collapsing of an infected lung to ""rest"" it and allow the lesions to heal—was used to treat tuberculosis. In 1834, F.H. Ramadge induced the first successful therapeutic pneumothorax, and reported subsequently the patient was cured. Later, in 1906, Albert Calmette and Camille Guérin developed a drug against tuberculosis from attenuated bovine-strain tuberculosis, the first genuine success in  immunizing against tuberculosis. In addition, Albert Schatz, Elizabeth Bugie, and Selman Waksman developed Streptomycin, the first effective antibiotic for tuberculosis and the first effective antibiotic against ""M. tuberculosis"". Since then, medical researchers Walsh McDermott made his own contribution when he tested the first oral mycobactericidal drug on tuberculosis. Finally, in 1957, scientist Piero Sensi and Maria Teresa Timbal became the first to isolate Rifamycins, a group of antibiotics that particularly effective against mycobacteria, and are therefore used to treat tuberculosis.  ","Rifamycins were first isolated in 1957 from a fermentation culture of Streptomyces mediterranei at the laboratory of Gruppo Lepetit SpA in Milan by two scientist named Piero Sensi and Maria Teresa Timbal, working with the Israeli scientist Pinhas Margalith. 
The rifamycins are a group of antibiotics that are synthesized either naturally by the bacterium Amycolatopsis rifamycinica or artificially. 
Rifamycins are particularly effective against mycobacteria, and are therefore used to treat tuberculosis, leprosy, and mycobacterium avium complex (MAC) infections.",History of tuberculosis: https://en.wikipedia.org/wiki/History%20of%20tuberculosis,4,Who came up with the first vaccine immunizing against tuberculosis?,Albert Calmette and Camille Guérin
-962065981949449467,Who won the final hoh big brother 20?,1,"Kaycee Clark  won the Final Head of House in Big Brother 20, which is the 20th season of the American reality television series Big Brother, an American television reality competition in which a group of contestants, known as ""House Guests"", live together in a specially constructed house that is isolated from the outside world for a cash prize of $500,000 or $750,000 in the 23rd season. The House Guests are continuously monitored during their stay and throughout the course of the competition, House Guests are evicted from the house, by being voted out of the competition. Sarah Harding won the  final vote in the British version Celebrity Big Brother 20. ","Big Brother 20 is the 20th season of the American reality television series Big Brother.
Big Brother is an American television reality competition show based on the original Dutch reality show of the same name created by producer John de Mol in 1997.[4] 
The show broadly follows the premise of other versions of the format, in which a group of contestants, known as ""HouseGuests"", live together in a specially constructed house that is isolated from the outside world for a cash prize of $500,000 (or $750,000 in the 23rd season). The HouseGuests are continuously monitored during their stay in the house by live television cameras as well as personal audio microphones. Throughout the course of the competition, HouseGuests are evicted from the house, by being voted out of the competition. 
Head of Household (HOH)","Big Brother (British series 19): https://en.wikipedia.org/wiki/Big%20Brother%20%28British%20series%2019%29
Big Brother (German TV series): https://en.wikipedia.org/wiki/Big%20Brother%20%28German%20TV%20series%29
Celebrity Big Brother (British series 20): https://en.wikipedia.org/wiki/Celebrity%20Big%20Brother%20%28British%20series%2020%29
Big Brother (British TV series): https://en.wikipedia.org/wiki/Big%20Brother%20%28British%20TV%20series%29
Big Brother 20 (American season): https://en.wikipedia.org/wiki/Big%20Brother%2020%20%28American%20season%29",1,Who won the final vote in the British reality show Celebrity Big Brother 20?,Sarah Harding
-4891954000928831702,The repetition of phrases or sentences with similar structures or meanings is called?,1,"In rhetoric, Parallel Syntax (also known as parallel construction and parallelism) is a rhetorical device that consists of repetition among adjacent sentences or clauses. The repeated sentences or clauses provides emphasis to a center theme or idea the author is trying to convey. Schesis onomaton is a rhetorical technique used to emphasize an idea by repeating it rapidly using slightly different words that have the same or a very similar meaning.",[NO_KNOWLEDGE_AVAILABLE],"Schesis onomaton: https://en.wikipedia.org/wiki/Schesis%20onomaton
Glossary of rhetorical terms: https://en.wikipedia.org/wiki/Glossary%20of%20rhetorical%20terms
Parallel syntax: https://en.wikipedia.org/wiki/Parallel%20syntax
Parallelism (grammar): https://en.wikipedia.org/wiki/Parallelism%20%28grammar%29",1,The repetition of phrases or sentences with similar meanings is called?,Schesis onomaton
8369552384426926962,When does the new season of the expanse start?,0,"There has been multiple seasons of the American science fiction television series The Expanse. Season one came out on December 14, 2015, season two came out February 1, 2017, season three came out April 11, 2018 and season four came out December 12, 2019.","The Expanse is an American science fiction television series developed by Mark Fergus and Hawk Ostby, based on the series of novels of the same name by James S. A. Corey. ",The Expanse (TV series): https://en.wikipedia.org/wiki/The%20Expanse%20%28TV%20series%29,0,When does the new season 1 of the expanse start?,"December 14, 2015"
-4728900912577712058,Who played kelly on the drew carey show?,0,"The Drew Carey Show is an American television sitcom that has had a few actresses with the name Kelly. There was Cynthia Watros who played Kellie Newmark, Marlo Kelly played by Jenny McCarthy, Grace Kelly played by Brett Butler (Brett Anderson) and Kelly Walker played by Anna Gunn. ","The Drew Carey Show is an American television sitcom that aired on ABC from September 13, 1995, to September 8, 2004","Anna Gunn: https://en.wikipedia.org/wiki/Anna%20Gunn
The Drew Carey Show: https://en.wikipedia.org/wiki/The%20Drew%20Carey%20Show
Drew Carey: https://en.wikipedia.org/wiki/Drew%20Carey
Grace Kelly: https://en.wikipedia.org/wiki/Grace%20Kelly
Susan Sutherland Isaacs: https://en.wikipedia.org/wiki/Susan%20Sutherland%20Isaacs
Susan Isaacs (disambiguation): https://en.wikipedia.org/wiki/Susan%20Isaacs%20%28disambiguation%29
List of The Drew Carey Show characters: https://en.wikipedia.org/wiki/List%20of%20The%20Drew%20Carey%20Show%20characters
Brett Butler (actress): https://en.wikipedia.org/wiki/Brett%20Butler%20%28actress%29
Brigitte Nielsen: https://en.wikipedia.org/wiki/Brigitte%20Nielsen
Susan Isaacs: https://en.wikipedia.org/wiki/Susan%20Isaacs",2,Who played Grace kelly on the drew carey show?,"Brett Butler ,  Brett Anderson"
